number,value,datetime_start,datetime_complete,duration,params_activation_fn,params_gae_lambda,params_gamma,params_learning_rate,params_max_grad_norm,params_n_steps,params_net_arch,user_attrs_Model,state
0,117.3574015476579,2022-09-09 00:36:15.621124,2022-09-09 07:34:05.745194,0 days 06:57:50.124070,leaky_relu,0.92,0.999,0.0019087614756145956,0.8,2048,big,A2C,COMPLETE
1,-60.420766978116546,2022-09-09 00:36:18.450241,2022-09-09 07:51:44.849320,0 days 07:15:26.399079,relu,0.95,0.995,0.6158112956118994,0.8,16,small,A2C,COMPLETE
2,-86.77280618188315,2022-09-09 00:36:21.586112,2022-09-09 07:59:03.150604,0 days 07:22:41.564492,elu,0.8,0.99,0.01592332011606663,2.0,1024,small,A2C,COMPLETE
3,-218.51812842195574,2022-09-09 00:36:24.468711,2022-09-09 07:35:55.795831,0 days 06:59:31.327120,elu,0.95,0.9,0.3267161048252414,0.9,256,small,A2C,COMPLETE
4,79.05205212654214,2022-09-09 00:36:27.561458,2022-09-09 09:20:51.376374,0 days 08:44:23.814916,leaky_relu,0.9,0.9999,0.004059575400896525,0.8,512,medium,A2C,COMPLETE
5,-45.739586934520936,2022-09-09 00:36:30.477637,2022-09-09 07:34:06.892972,0 days 06:57:36.415335,tanh,0.8,0.9999,0.03156589231623511,0.9,64,big,A2C,COMPLETE
6,102.58165153744933,2022-09-09 00:36:33.562995,2022-09-09 09:02:53.892967,0 days 08:26:20.329972,leaky_relu,0.8,0.99,0.0001897012873055795,1.0,8,big,A2C,COMPLETE
7,412.88121418632846,2022-09-09 00:36:36.503991,2022-09-09 07:30:47.802955,0 days 06:54:11.298964,tanh,0.95,0.98,0.0007276515301192982,1.0,128,big,A2C,COMPLETE
8,499.1458379005691,2022-09-09 07:30:47.864946,2022-09-09 14:20:41.025626,0 days 06:49:53.160680,tanh,0.92,0.95,0.00034967798145586597,0.3,1024,medium,A2C,COMPLETE
9,-209.95121172337107,2022-09-09 07:34:05.810038,2022-09-09 15:45:10.905950,0 days 08:11:05.095912,elu,0.98,0.95,0.7652537050471566,0.7,32,medium,A2C,COMPLETE
10,-114.09443356162403,2022-09-09 07:34:06.963081,2022-09-09 14:24:06.448144,0 days 06:49:59.485063,relu,0.98,0.9999,0.0006720302766658408,2.0,512,medium,A2C,COMPLETE
11,-218.08599135689414,2022-09-09 07:35:55.861281,2022-09-09 15:27:45.213667,0 days 07:51:49.352386,tanh,0.8,0.95,0.04165773924386228,5.0,256,small,A2C,COMPLETE
12,475.6666750627436,2022-09-09 07:51:44.925951,2022-09-09 15:23:31.942367,0 days 07:31:47.016416,tanh,0.9,0.99,4.9702900816342993e-05,0.6,8,medium,A2C,COMPLETE
13,507.3051197574861,2022-09-09 07:59:03.447776,2022-09-09 15:26:42.430436,0 days 07:27:38.982660,tanh,0.8,0.95,0.00019894075588683488,0.3,8,small,A2C,COMPLETE
14,244.37619440136822,2022-09-09 09:02:53.989214,2022-09-09 17:13:37.166030,0 days 08:10:43.176816,tanh,0.95,0.95,1.9687313218264388e-05,0.3,64,big,A2C,COMPLETE
15,-188.68958492260643,2022-09-09 09:20:51.474653,2022-09-09 18:01:50.937294,0 days 08:40:59.462641,leaky_relu,0.92,0.9999,0.0037468806060387,2.0,32,small,A2C,COMPLETE
16,21.562305513237636,2022-09-09 14:20:41.084466,2022-09-09 21:34:22.651994,0 days 07:13:41.567528,elu,0.98,0.98,0.005095779888888422,0.6,2048,medium,A2C,COMPLETE
17,382.20795047495756,2022-09-09 14:24:06.507491,2022-09-09 21:19:27.378870,0 days 06:55:20.871379,tanh,0.99,0.95,0.00020096765417812397,0.3,256,medium,A2C,COMPLETE
18,360.95038000684104,2022-09-09 15:23:32.012898,2022-09-09 23:02:40.380260,0 days 07:39:08.367362,tanh,0.9,0.99,0.00029491472824435676,0.6,8,medium,A2C,COMPLETE
19,81.27351433708536,2022-09-09 15:26:42.505588,2022-09-09 22:47:51.569977,0 days 07:21:09.064389,tanh,0.8,0.95,0.0024889369758278866,0.3,8,small,A2C,COMPLETE
20,203.90768542298346,2022-09-09 15:27:45.276002,2022-09-09 23:58:32.872553,0 days 08:30:47.596551,tanh,0.95,0.95,2.742251336076069e-05,0.3,1024,medium,A2C,COMPLETE
21,-57.93436074613436,2022-09-09 15:45:10.980012,2022-09-10 00:27:55.612522,0 days 08:42:44.632510,tanh,0.8,0.95,0.001727013706637094,0.3,8,medium,A2C,COMPLETE
22,302.99648520124117,2022-09-09 17:13:37.242847,2022-09-10 01:18:15.477725,0 days 08:04:38.234878,elu,0.8,0.95,3.016120670551059e-05,0.3,8,small,A2C,COMPLETE
23,400.3546798572349,2022-09-09 18:01:51.020397,2022-09-10 02:37:07.624515,0 days 08:35:16.604118,tanh,0.92,0.98,0.002666836708513849,0.8,1024,medium,A2C,COMPLETE
24,227.93261716797173,2022-09-09 21:19:27.435793,2022-09-10 04:28:41.986275,0 days 07:09:14.550482,tanh,0.8,0.98,1.5888280146945983e-05,0.3,8,small,A2C,COMPLETE
25,195.064718098293,2022-09-09 21:34:22.709580,2022-09-10 04:52:36.307215,0 days 07:18:13.597635,tanh,0.92,0.9,0.005232760743206138,0.3,1024,medium,A2C,COMPLETE
26,137.45770026231557,2022-09-09 22:47:51.633149,2022-09-10 05:59:09.029207,0 days 07:11:17.396058,elu,0.8,0.9999,0.00015563657576734524,0.3,128,medium,A2C,COMPLETE
27,419.37334961407805,2022-09-09 23:02:40.435543,2022-09-10 06:30:30.720485,0 days 07:27:50.284942,leaky_relu,0.92,0.98,2.3149734730322984e-05,2.0,1024,medium,A2C,COMPLETE
28,350.78773185798053,2022-09-09 23:58:32.926277,2022-09-10 08:18:42.408800,0 days 08:20:09.482523,tanh,0.92,0.95,0.002498809597194057,0.5,2048,medium,A2C,COMPLETE
29,167.69363302462193,2022-09-10 00:27:55.665888,2022-09-10 08:59:03.714976,0 days 08:31:08.049088,elu,0.9,0.999,2.993906856681759e-05,0.9,8,medium,A2C,COMPLETE
30,406.5824217980651,2022-09-10 01:18:15.531595,2022-09-10 08:03:34.777657,0 days 06:45:19.246062,tanh,0.92,0.999,0.0017049497457584494,1.0,1024,medium,A2C,COMPLETE
31,100.62537512325983,2022-09-10 02:37:07.696033,2022-09-10 11:06:23.521798,0 days 08:29:15.825765,leaky_relu,0.92,0.999,0.0002446181767020187,0.3,1024,medium,A2C,COMPLETE
32,317.69871131307053,2022-09-10 04:28:42.041808,2022-09-10 11:45:48.074278,0 days 07:17:06.032470,tanh,0.9,0.9,1.029742353720465e-05,0.9,8,medium,A2C,COMPLETE
33,233.54246935521078,2022-09-10 04:52:36.378636,2022-09-10 12:13:11.297216,0 days 07:20:34.918580,tanh,0.99,0.9,3.891337875394357e-05,0.6,512,medium,A2C,COMPLETE
34,324.7002538478005,2022-09-10 05:59:09.082032,2022-09-10 12:36:34.844615,0 days 06:37:25.762583,leaky_relu,0.9,0.99,6.137559073314614e-05,0.9,256,medium,A2C,COMPLETE
35,180.03478773268802,2022-09-10 06:30:30.781371,2022-09-10 14:18:22.406547,0 days 07:47:51.625176,tanh,0.99,0.99,1.579698919846374e-05,0.7,2048,medium,A2C,COMPLETE
36,243.45429387013968,2022-09-10 08:03:34.831135,2022-09-10 14:47:44.537572,0 days 06:44:09.706437,relu,0.92,0.95,0.0001158520839891908,0.3,32,medium,A2C,COMPLETE
37,197.49055648924866,2022-09-10 08:18:42.492027,2022-09-10 16:19:55.374597,0 days 08:01:12.882570,tanh,0.92,0.95,4.602797696127519e-05,0.8,512,small,A2C,COMPLETE
38,259.4309482506768,2022-09-10 08:59:03.770881,2022-09-10 17:19:32.144435,0 days 08:20:28.373554,leaky_relu,0.92,0.9999,0.00010611178904835614,0.3,1024,big,A2C,COMPLETE
39,464.9788033149547,2022-09-10 11:06:23.576872,2022-09-10 19:36:35.460607,0 days 08:30:11.883735,elu,0.92,0.98,1.7235205660075382e-05,2.0,32,medium,A2C,COMPLETE
40,472.9564499151111,2022-09-10 11:45:48.132152,2022-09-10 18:32:27.370533,0 days 06:46:39.238381,leaky_relu,0.8,0.99,1.8834288197999604e-05,2.0,1024,medium,A2C,COMPLETE
41,198.04492626902513,2022-09-10 12:13:11.358972,2022-09-10 18:58:11.659967,0 days 06:45:00.300995,leaky_relu,0.9,0.98,0.00016705033728555685,2.0,1024,medium,A2C,COMPLETE
42,365.3254394191075,2022-09-10 12:36:34.897920,2022-09-10 19:18:41.428084,0 days 06:42:06.530164,relu,0.9,0.98,6.41752426945031e-05,2.0,1024,medium,A2C,COMPLETE
43,80.27757424481891,2022-09-10 14:18:22.462834,2022-09-10 21:45:01.642723,0 days 07:26:39.179889,leaky_relu,0.92,0.99,0.00018704495465534946,2.0,64,medium,A2C,COMPLETE
44,356.5227898110161,2022-09-10 14:47:44.589958,2022-09-10 21:34:18.134815,0 days 06:46:33.544857,elu,0.99,0.98,2.786047274266535e-05,2.0,1024,big,A2C,COMPLETE
45,85.8692758015483,2022-09-10 16:19:55.454531,2022-09-11 00:05:05.166954,0 days 07:45:09.712423,relu,0.92,0.98,0.0002195362471292754,2.0,1024,medium,A2C,COMPLETE
46,402.02137777605856,2022-09-10 17:19:32.196383,2022-09-11 01:04:14.844784,0 days 07:44:42.648401,leaky_relu,0.92,0.98,1.4372204271373365e-05,0.5,16,medium,A2C,COMPLETE
47,269.75763484260335,2022-09-10 18:32:27.424611,2022-09-11 01:41:22.775736,0 days 07:08:55.351125,tanh,0.9,0.99,1.2641436235077707e-05,1.0,16,medium,A2C,COMPLETE
48,477.5848246000486,2022-09-10 18:58:11.713923,2022-09-11 02:04:53.092998,0 days 07:06:41.379075,elu,0.8,0.99,1.2975910554734714e-05,2.0,1024,medium,A2C,COMPLETE
49,245.07275184919263,2022-09-10 19:18:41.481484,2022-09-11 03:11:22.397223,0 days 07:52:40.915739,tanh,0.8,0.99,3.166978477962581e-05,2.0,1024,medium,A2C,COMPLETE
50,466.7298902884774,2022-09-10 19:36:35.530001,2022-09-11 02:30:59.240680,0 days 06:54:23.710679,elu,0.92,0.98,2.7239321915370674e-05,0.6,32,small,A2C,COMPLETE
51,449.5043004529654,2022-09-10 21:34:18.186457,2022-09-11 04:28:44.079706,0 days 06:54:25.893249,elu,0.8,0.99,2.4394606724683312e-05,2.0,1024,medium,A2C,COMPLETE
52,402.50994926011015,2022-09-10 21:45:01.709029,2022-09-11 06:01:31.085440,0 days 08:16:29.376411,elu,0.95,0.98,1.1794448490093244e-05,5.0,32,medium,A2C,COMPLETE
53,460.61995173785726,2022-09-11 00:05:05.237512,2022-09-11 07:34:57.542859,0 days 07:29:52.305347,elu,0.92,0.98,4.707044733118361e-05,2.0,32,small,A2C,COMPLETE
54,257.0788428877925,2022-09-11 01:04:14.899097,2022-09-11 07:48:45.208980,0 days 06:44:30.309883,leaky_relu,0.9,0.995,3.210267748326701e-05,0.6,32,medium,A2C,COMPLETE
55,421.09964538504937,2022-09-11 01:41:22.842738,2022-09-11 09:01:44.146183,0 days 07:20:21.303445,elu,0.95,0.98,1.273854530147473e-05,1.0,32,medium,A2C,COMPLETE
56,473.8826777993854,2022-09-11 02:04:53.152905,2022-09-11 09:25:34.828478,0 days 07:20:41.675573,elu,0.8,0.99,2.116908846981851e-05,2.0,1024,medium,A2C,COMPLETE
57,85.78370636417371,2022-09-11 02:30:59.292163,2022-09-11 09:35:16.418924,0 days 07:04:17.126761,elu,0.8,0.99,0.00021012434425743726,2.0,1024,medium,A2C,COMPLETE
58,268.9607995999853,2022-09-11 03:11:22.467631,2022-09-11 11:58:21.425965,0 days 08:46:58.958334,elu,0.92,0.995,5.374447874258519e-05,0.6,32,big,A2C,COMPLETE
59,261.1222591190864,2022-09-11 04:28:44.135232,2022-09-11 11:49:24.681030,0 days 07:20:40.545798,elu,0.92,0.995,0.00016391768871873278,0.6,32,small,A2C,COMPLETE
60,379.00847552274064,2022-09-11 06:01:31.162296,2022-09-11 15:17:10.527312,0 days 09:15:39.365016,leaky_relu,0.8,0.99,2.1691144807105908e-05,2.0,32,medium,A2C,COMPLETE
61,327.0621096018836,2022-09-11 07:34:57.599010,2022-09-11 14:44:35.833203,0 days 07:09:38.234193,leaky_relu,0.95,0.99,4.496791877122808e-05,2.0,1024,medium,A2C,COMPLETE
62,430.7948463565308,2022-09-11 07:48:45.263163,2022-09-11 14:30:12.435597,0 days 06:41:27.172434,elu,0.92,0.995,0.00010140465962261393,0.6,2048,small,A2C,COMPLETE
63,236.45790577993543,2022-09-11 09:01:44.198456,2022-09-11 16:13:01.258927,0 days 07:11:17.060471,elu,0.92,0.98,0.00029197562020989547,0.6,256,small,A2C,COMPLETE
64,391.5063686067859,2022-09-11 09:25:34.889605,2022-09-11 16:47:22.785469,0 days 07:21:47.895864,elu,0.8,0.995,1.0226419205068316e-05,0.8,1024,small,A2C,COMPLETE
65,521.7687893284738,2022-09-11 09:35:16.472975,2022-09-11 16:58:10.531547,0 days 07:22:54.058572,tanh,0.8,0.95,4.803222655358794e-05,0.6,8,big,A2C,COMPLETE
66,479.0730629019633,2022-09-11 11:49:24.736298,2022-09-11 18:57:22.510499,0 days 07:07:57.774201,leaky_relu,0.8,0.99,1.8059207729522065e-05,0.9,1024,medium,A2C,COMPLETE
67,428.77468988298006,2022-09-11 11:58:21.500624,2022-09-11 20:43:52.126923,0 days 08:45:30.626299,leaky_relu,0.8,0.99,4.160566133180983e-05,0.3,2048,medium,A2C,COMPLETE
68,523.9275895049541,2022-09-11 14:30:12.488489,2022-09-11 21:34:12.879329,0 days 07:04:00.390840,tanh,0.92,0.95,0.0006037450364261861,0.9,1024,big,A2C,COMPLETE
69,494.7586000428205,2022-09-11 14:44:35.893361,2022-09-11 21:46:19.374135,0 days 07:01:43.480774,leaky_relu,0.8,0.99,2.3435672717660052e-05,0.3,2048,medium,A2C,COMPLETE
70,-149.40882114928604,2022-09-11 15:17:10.584390,2022-09-12 00:23:55.995499,0 days 09:06:45.411109,elu,0.92,0.95,0.0011196546973791283,0.7,1024,medium,A2C,COMPLETE
71,370.47683534514,2022-09-11 16:13:01.324585,2022-09-11 23:27:25.796842,0 days 07:14:24.472257,tanh,0.98,0.95,5.881112192928574e-05,0.9,8,small,A2C,COMPLETE
72,415.57311324751646,2022-09-11 16:47:22.848503,2022-09-12 00:14:08.548126,0 days 07:26:45.699623,tanh,0.9,0.98,0.00010386969793591698,0.6,16,small,A2C,COMPLETE
73,436.48726701030563,2022-09-11 16:58:10.588184,2022-09-12 00:26:37.892225,0 days 07:28:27.304041,tanh,0.8,0.95,1.529337932758141e-05,0.6,8,big,A2C,COMPLETE
74,294.3760246214633,2022-09-11 18:57:22.568307,2022-09-12 02:01:44.157559,0 days 07:04:21.589252,elu,0.8,0.95,0.00018454378331441896,0.6,256,big,A2C,COMPLETE
75,331.1563320186043,2022-09-11 20:43:52.204920,2022-09-12 05:41:16.949693,0 days 08:57:24.744773,tanh,0.8,0.9999,0.0003728711145095952,0.6,8,big,A2C,COMPLETE
76,523.0692488735103,2022-09-11 21:34:12.930906,2022-09-12 04:44:52.883109,0 days 07:10:39.952203,tanh,0.92,0.95,0.0007532974364480656,0.8,1024,big,A2C,COMPLETE
77,404.569221046232,2022-09-11 21:46:19.434120,2022-09-12 04:35:48.383352,0 days 06:49:28.949232,tanh,0.8,0.95,0.00010517907419938815,0.6,2048,big,A2C,COMPLETE
78,524.153462623912,2022-09-11 23:27:25.859881,2022-09-12 06:25:46.953753,0 days 06:58:21.093872,tanh,0.92,0.95,0.00039219420017295303,0.9,1024,big,A2C,COMPLETE
79,526.1465539685557,2022-09-12 00:14:08.626135,2022-09-12 08:12:09.733439,0 days 07:58:01.107304,tanh,0.92,0.95,0.0005445650243683736,0.6,1024,big,A2C,COMPLETE
80,261.8834693379302,2022-09-12 00:23:56.076237,2022-09-12 09:27:31.983612,0 days 09:03:35.907375,tanh,0.8,0.95,4.354239606973713e-05,0.6,2048,big,A2C,COMPLETE
81,325.1278052940288,2022-09-12 00:26:37.954611,2022-09-12 07:39:23.707223,0 days 07:12:45.752612,tanh,0.92,0.95,0.0021410021346056967,0.9,1024,big,A2C,COMPLETE
82,523.4325371651796,2022-09-12 02:01:44.223648,2022-09-12 09:57:34.480948,0 days 07:55:50.257300,tanh,0.92,0.95,0.000561507424231169,0.9,1024,big,A2C,COMPLETE
83,343.6740469668175,2022-09-12 04:35:48.438852,2022-09-12 11:33:41.212343,0 days 06:57:52.773491,tanh,0.92,0.95,8.484696867112849e-05,0.9,1024,big,A2C,COMPLETE
84,503.79361538427213,2022-09-12 04:44:52.949338,2022-09-12 12:56:15.091568,0 days 08:11:22.142230,tanh,0.92,0.95,0.0002511297348965346,0.8,1024,big,A2C,COMPLETE
85,409.7900396552426,2022-09-12 05:41:17.026564,2022-09-12 14:21:57.699276,0 days 08:40:40.672712,tanh,0.92,0.95,0.0018308033037721769,0.9,1024,big,A2C,COMPLETE
86,352.78440743667625,2022-09-12 06:25:47.006891,2022-09-12 13:26:00.154994,0 days 07:00:13.148103,tanh,0.8,0.95,0.0029699080709886696,0.9,1024,big,A2C,COMPLETE
87,221.04252814378978,2022-09-12 07:39:23.760131,2022-09-12 15:30:36.402157,0 days 07:51:12.642026,tanh,0.92,0.999,3.916450953280065e-05,0.8,1024,big,A2C,COMPLETE
88,199.579303811452,2022-09-12 08:12:09.817770,2022-09-12 16:19:15.183333,0 days 08:07:05.365563,tanh,0.92,0.95,1.5936648501580033e-05,0.6,1024,big,A2C,COMPLETE
89,445.73107103894847,2022-09-12 09:27:32.057829,2022-09-12 18:30:43.144416,0 days 09:03:11.086587,tanh,0.92,0.9999,0.0008830975065575,0.6,1024,small,A2C,COMPLETE
90,373.05297557088,2022-09-12 09:57:34.557938,2022-09-12 18:15:18.303353,0 days 08:17:43.745415,elu,0.95,0.95,0.00029982344981546684,0.9,1024,big,A2C,COMPLETE
91,-76.99447596337573,2022-09-12 11:33:41.275587,2022-09-12 18:48:18.824130,0 days 07:14:37.548543,tanh,0.92,0.995,0.00842713116429352,0.6,1024,big,A2C,COMPLETE
92,488.27216659526266,2022-09-12 12:56:15.168515,2022-09-12 21:32:54.659056,0 days 08:36:39.490541,tanh,0.95,0.95,0.00029467312818080155,0.8,1024,big,A2C,COMPLETE
93,170.32308474507056,2022-09-12 13:26:00.214066,2022-09-12 20:34:01.707426,0 days 07:08:01.493360,tanh,0.98,0.9,0.004196587630296408,0.8,1024,big,A2C,COMPLETE
94,364.87327650223267,2022-09-12 14:21:57.774290,2022-09-12 23:08:40.835172,0 days 08:46:43.060882,leaky_relu,0.92,0.95,0.0001184758856513062,0.6,128,big,A2C,COMPLETE
95,442.5972140490905,2022-09-12 15:30:36.480526,2022-09-12 23:46:19.905367,0 days 08:15:43.424841,tanh,0.92,0.95,0.0002731611746077591,0.3,16,medium,A2C,COMPLETE
96,-11.898791433021557,2022-09-12 16:19:15.259816,2022-09-13 00:32:19.251114,0 days 08:13:03.991298,tanh,0.92,0.95,0.023985938365055446,0.8,32,big,A2C,COMPLETE
97,488.94997419068807,2022-09-12 18:15:18.356017,2022-09-13 02:23:21.259784,0 days 08:08:02.903767,tanh,0.92,0.995,0.0003728170651355227,2.0,1024,big,A2C,COMPLETE
98,358.2150614169831,2022-09-12 18:30:43.231024,2022-09-13 03:25:01.836659,0 days 08:54:18.605635,tanh,0.99,0.95,0.0002274258590311047,0.8,1024,medium,A2C,COMPLETE
99,459.16587587786944,2022-09-12 18:48:18.891913,2022-09-13 02:17:30.595228,0 days 07:29:11.703315,tanh,0.98,0.95,0.0003729998152410367,0.8,1024,big,A2C,COMPLETE
100,382.59289597915887,2022-09-12 20:34:01.761997,2022-09-13 03:48:36.251405,0 days 07:14:34.489408,tanh,0.92,0.95,0.0034851742419184308,0.8,2048,big,A2C,COMPLETE
101,149.72706574561457,2022-09-12 21:32:54.733802,2022-09-13 06:16:19.488290,0 days 08:43:24.754488,leaky_relu,0.92,0.95,0.00011246228244468209,0.8,32,big,A2C,COMPLETE
102,135.13958288852422,2022-09-12 23:08:40.911031,2022-09-13 07:58:21.773930,0 days 08:49:40.862899,elu,0.92,0.95,0.0008553265052219296,0.8,32,big,A2C,COMPLETE
103,-20.746673368511882,2022-09-12 23:46:19.959924,2022-09-13 08:07:30.553563,0 days 08:21:10.593639,leaky_relu,0.92,0.95,0.005140590341187194,0.8,8,big,A2C,COMPLETE
104,97.18671871470056,2022-09-13 00:32:19.305794,2022-09-13 08:54:59.055558,0 days 08:22:39.749764,elu,0.92,0.95,0.0001509214906102118,1.0,8,big,A2C,COMPLETE
105,430.2009429809929,2022-09-13 02:17:30.668480,2022-09-13 10:18:20.204825,0 days 08:00:49.536345,tanh,0.8,0.95,6.911944673513703e-05,0.8,8,small,A2C,COMPLETE
106,196.16008368084368,2022-09-13 02:23:21.336980,2022-09-13 10:26:13.697480,0 days 08:02:52.360500,relu,0.92,0.95,0.002329070682418162,0.3,1024,big,A2C,COMPLETE
107,456.2188828404157,2022-09-13 03:25:01.892172,2022-09-13 12:28:02.854291,0 days 09:03:00.962119,tanh,0.92,0.98,0.0004350741892433735,0.8,8,big,A2C,COMPLETE
108,286.8756772445564,2022-09-13 03:48:36.318552,2022-09-13 11:26:26.645065,0 days 07:37:50.326513,tanh,0.99,0.995,0.0005247806655063237,2.0,2048,big,A2C,COMPLETE
109,43.88127470982214,2022-09-13 06:16:19.541484,2022-09-13 14:50:04.621794,0 days 08:33:45.080310,relu,0.92,0.995,0.0007007771419627832,0.9,256,big,A2C,COMPLETE
110,535.3473981717455,2022-09-13 07:58:21.846740,2022-09-13 16:30:25.889737,0 days 08:32:04.042997,tanh,0.8,0.995,0.00023053688940676576,2.0,1024,big,A2C,COMPLETE
111,351.1128850846001,2022-09-13 08:07:30.628224,2022-09-13 15:07:00.444529,0 days 06:59:29.816305,tanh,0.92,0.995,0.00011124213834059155,2.0,1024,big,A2C,COMPLETE
112,247.78138621412276,2022-09-13 08:54:59.129570,2022-09-13 16:58:21.311191,0 days 08:03:22.181621,tanh,0.92,0.995,5.0997757910275175e-05,2.0,1024,big,A2C,COMPLETE
113,106.39850260716825,2022-09-13 10:18:20.283577,2022-09-13 18:09:27.664930,0 days 07:51:07.381353,relu,0.98,0.95,0.000670664806530534,0.9,512,big,A2C,COMPLETE
114,336.4643125861434,2022-09-13 10:26:13.752723,2022-09-13 18:23:13.019130,0 days 07:56:59.266407,tanh,1.0,0.98,0.0010108510281383407,0.7,1024,big,A2C,COMPLETE
115,-136.04495624527948,2022-09-13 11:26:26.709362,2022-09-13 19:04:03.264968,0 days 07:37:36.555606,tanh,0.92,0.995,0.00795519682888383,2.0,256,big,A2C,COMPLETE
116,379.0877487485383,2022-09-13 12:28:02.931210,2022-09-13 20:37:41.399848,0 days 08:09:38.468638,tanh,0.92,0.995,0.00048611993810643257,2.0,1024,small,A2C,COMPLETE
117,359.6003364295877,2022-09-13 14:50:04.693019,2022-09-13 23:23:45.088449,0 days 08:33:40.395430,tanh,0.99,0.98,0.0006533589072123616,0.3,1024,big,A2C,COMPLETE
118,301.4277490470713,2022-09-13 15:07:00.496206,2022-09-13 21:50:48.137619,0 days 06:43:47.641413,tanh,0.95,0.95,0.0002056799244773483,0.3,256,small,A2C,COMPLETE
119,263.5924331828502,2022-09-13 16:30:25.942559,2022-09-14 00:55:17.208374,0 days 08:24:51.265815,tanh,0.8,0.95,4.497643975350794e-05,0.3,64,small,A2C,COMPLETE
120,259.3434730096552,2022-09-13 16:58:21.367510,2022-09-14 00:38:05.656276,0 days 07:39:44.288766,elu,0.8,0.995,0.0002503762153300042,2.0,1024,big,A2C,COMPLETE
121,300.20687154015604,2022-09-13 18:09:27.740229,2022-09-14 02:06:28.831107,0 days 07:57:01.090878,tanh,0.8,0.995,0.00011900124064263574,2.0,512,small,A2C,COMPLETE
122,482.5367857686937,2022-09-13 18:23:13.091416,2022-09-14 02:19:43.092823,0 days 07:56:30.001407,tanh,0.92,0.95,0.00020277021834981445,5.0,1024,medium,A2C,COMPLETE
123,252.61251255174793,2022-09-13 19:04:03.335707,2022-09-14 02:45:34.639013,0 days 07:41:31.303306,tanh,0.8,0.995,3.673323817456735e-05,0.3,1024,big,A2C,COMPLETE
124,233.59950280247168,2022-09-13 20:37:41.456119,2022-09-14 04:33:45.744250,0 days 07:56:04.288131,elu,0.8,0.995,0.004070344096459931,2.0,1024,big,A2C,COMPLETE
125,461.10876801883813,2022-09-13 21:50:48.189459,2022-09-14 05:12:38.574871,0 days 07:21:50.385412,tanh,0.8,0.9,0.00047363342184569043,0.5,8,small,A2C,COMPLETE
126,194.9509741318014,2022-09-13 23:23:45.159939,2022-09-14 08:03:09.077331,0 days 08:39:23.917392,leaky_relu,0.92,0.95,0.0005076206820187989,0.5,1024,big,A2C,COMPLETE
127,545.4054606175981,2022-09-14 00:38:05.727162,2022-09-14 07:28:14.586413,0 days 06:50:08.859251,tanh,0.8,0.9999,0.00033244814335368894,2.0,1024,big,A2C,COMPLETE
128,252.37096271885653,2022-09-14 00:55:17.285596,2022-09-14 09:33:34.248918,0 days 08:38:16.963322,elu,0.92,0.95,0.0012383957109192694,0.6,1024,big,A2C,COMPLETE
129,72.78256081773904,2022-09-14 02:06:28.912584,2022-09-14 10:04:29.183119,0 days 07:58:00.270535,tanh,0.8,0.995,0.0012551076396634389,2.0,32,big,A2C,COMPLETE
130,507.60559709959244,2022-09-14 02:19:43.169517,2022-09-14 10:08:55.612272,0 days 07:49:12.442755,tanh,0.95,0.95,0.0006683906742208519,1.0,1024,big,A2C,COMPLETE
131,278.39251993843027,2022-09-14 02:45:34.690577,2022-09-14 10:11:22.045171,0 days 07:25:47.354594,tanh,0.95,0.95,0.0002251227546056782,0.8,1024,small,A2C,COMPLETE
