number,value,datetime_start,datetime_complete,duration,params_activation_fn,params_gae_lambda,params_gamma,params_learning_rate,params_max_grad_norm,params_n_steps,params_net_arch,user_attrs_Model,state
132,444.61780521594227,2022-09-14 04:33:45.801420,2022-09-14 12:14:05.550063,0 days 07:40:19.748643,tanh,1.0,0.95,0.00028916535366340696,5.0,32,big,A2C,COMPLETE
133,117.59965296356441,2022-09-14 05:12:38.634754,2022-09-14 13:09:19.235708,0 days 07:56:40.600954,tanh,0.95,0.95,0.0045291344328535,1.0,1024,big,A2C,COMPLETE
134,289.6496979518346,2022-09-14 07:28:14.641731,2022-09-14 14:14:54.366733,0 days 06:46:39.725002,tanh,1.0,0.99,0.001048290074580868,0.9,32,big,A2C,COMPLETE
135,213.37074805118885,2022-09-14 08:03:09.142476,2022-09-14 16:36:33.362866,0 days 08:33:24.220390,tanh,0.92,0.95,0.0010049411279247026,0.9,64,medium,A2C,COMPLETE
136,458.8974859462579,2022-09-14 09:33:34.301906,2022-09-14 17:58:08.685699,0 days 08:24:34.383793,tanh,0.92,0.95,0.0001136280398594356,0.5,256,big,A2C,COMPLETE
137,158.22033456563716,2022-09-14 10:04:29.237915,2022-09-14 17:45:54.673956,0 days 07:41:25.436041,tanh,0.8,0.9999,0.00284470945223787,2.0,128,big,A2C,COMPLETE
138,536.6365347109406,2022-09-14 10:08:55.687412,2022-09-14 17:56:03.707877,0 days 07:47:08.020465,tanh,0.8,0.9999,0.0007756401483410422,2.0,256,big,A2C,COMPLETE
139,-82.21031669705698,2022-09-14 10:11:22.103402,2022-09-14 17:41:13.825728,0 days 07:29:51.722326,tanh,0.95,0.9,0.0048446205414298445,1.0,16,big,A2C,COMPLETE
140,512.2439641104047,2022-09-14 12:14:05.603308,2022-09-14 19:49:39.435779,0 days 07:35:33.832471,tanh,0.8,0.9999,0.00016107241777005472,2.0,1024,big,A2C,COMPLETE
141,456.16153641202817,2022-09-14 13:09:19.310702,2022-09-14 21:15:34.591393,0 days 08:06:15.280691,tanh,0.8,0.9999,0.00012510753484901654,0.5,1024,big,A2C,COMPLETE
142,533.1969340615589,2022-09-14 14:14:54.426681,2022-09-14 21:14:14.741954,0 days 06:59:20.315273,tanh,0.8,0.9999,0.00022252139432469293,2.0,1024,big,A2C,COMPLETE
143,,2022-09-14 16:36:33.437733,,,tanh,0.92,0.95,0.0005880807360430946,0.6,64,big,A2C,RUNNING
144,,2022-09-14 17:41:13.891075,,,tanh,0.8,0.9,7.332759905630955e-05,2.0,1024,big,A2C,RUNNING
145,,2022-09-14 17:45:54.742927,,,tanh,0.8,0.9999,0.0001629047936780961,2.0,1024,big,A2C,RUNNING
146,,2022-09-14 17:56:03.781088,,,tanh,0.92,0.95,0.00018146396861127155,0.3,8,small,A2C,RUNNING
147,,2022-09-14 17:58:08.763965,,,relu,0.8,0.9999,0.0035172676214774647,2.0,256,big,A2C,RUNNING
148,,2022-09-14 19:49:39.491604,,,elu,0.99,0.9999,0.0006016937926413735,2.0,256,big,A2C,RUNNING
149,,2022-09-14 21:14:14.801243,,,tanh,0.98,0.9999,0.001226445258250907,2.0,256,big,A2C,RUNNING
150,,2022-09-14 21:15:34.670387,,,tanh,0.8,0.9999,2.8040933338671323e-05,2.0,64,big,A2C,RUNNING
